hsut product name,predicate,hiot product name
Paddy rice,OWL.SameAs,Paddy rice
Wheat,OWL.SameAs,Wheat
Cereal grains nec,OWL.SameAs,Cereal grains nec
Vegetables; fruit; nuts,OWL.SameAs,"Vegetables, fruit, nuts"
Oil seeds,OWL.SameAs,Oil seeds
Sugar cane; sugar beet,OWL.SameAs,"Sugar cane, sugar beet"
Plant-based fibers,OWL.SameAs,Plant-based fibers
Crops nec,OWL.SameAs,Crops nec
Cattle,OWL.SameAs,Cattle
Pigs,OWL.SameAs,Pigs
Poultry,OWL.SameAs,Poultry
Meat animals nec,OWL.SameAs,Meat animals nec
Animal products nec,OWL.SameAs,Animal products nec
Raw milk,OWL.SameAs,Raw milk
Wool; silk-worm cocoons,OWL.SameAs,"Wool, silk-worm cocoons"
Manure (conventional treatment),OWL.SameAs,Manure (conventional treatment)
Manure (biogas treatment),OWL.SameAs,Manure (biogas treatment)
Products of forestry; logging and related services (02),OWL.SameAs,"Products of forestry, logging and related services (02)"
Fish and other fishing products; services incidental of fishing (05),OWL.SameAs,Fish and other fishing products; services incidental of fishing (05)
Anthracite,rdfs:subClassOf,"Coal, lignite and peat"
Coking Coal,rdfs:subClassOf,"Coal, lignite and peat"
Other Bituminous Coal,rdfs:subClassOf,"Coal, lignite and peat"
Sub-Bituminous Coal,rdfs:subClassOf,"Coal, lignite and peat"
Patent Fuel,rdfs:subClassOf,"Coal, lignite and peat"
Lignite/Brown Coal,rdfs:subClassOf,"Coal, lignite and peat"
BKB/Peat Briquettes,rdfs:subClassOf,"Coal, lignite and peat"
Peat,rdfs:subClassOf,"Coal, lignite and peat"
Crude petroleum and services related to crude oil extraction; excluding surveying,OWL.SameAs,"Crude petroleum and services related to crude oil extraction, excluding surveying"
Natural gas and services related to natural gas extraction; excluding surveying,rdfs:subClassOf,"Natural gas and services related to natural gas extraction, excluding surveying; inclulding liquid gas"
Natural Gas Liquids,rdfs:subClassOf,"Natural gas and services related to natural gas extraction, excluding surveying; inclulding liquid gas"
Other Hydrocarbons,OWL.SameAs,Other Hydrocarbons
Uranium and thorium ores (12),OWL.SameAs,Uranium and thorium ores (12)
Iron ores,OWL.SameAs,Iron ores
Copper ores and concentrates,OWL.SameAs,Copper ores and concentrates
Nickel ores and concentrates,OWL.SameAs,Nickel ores and concentrates
Aluminium ores and concentrates,OWL.SameAs,Aluminium ores and concentrates
Precious metal ores and concentrates,OWL.SameAs,Precious metal ores and concentrates
Lead; zinc and tin ores and concentrates,OWL.SameAs,"Lead, zinc and tin ores and concentrates"
Other non-ferrous metal ores and concentrates,OWL.SameAs,Other non-ferrous metal ores and concentrates
Stone,OWL.SameAs,Stone
Sand and clay,OWL.SameAs,Sand and clay
Chemical and fertilizer minerals; salt and other mining and quarrying products n.e.c.,OWL.SameAs,"Chemical and fertilizer minerals, salt and other mining and quarrying products n.e.c."
Products of meat cattle,OWL.SameAs,Products of meat cattle
Products of meat pigs,OWL.SameAs,Products of meat pigs
Products of meat poultry,OWL.SameAs,Products of meat poultry
Meat products nec,OWL.SameAs,Meat products nec
products of Vegetable oils and fats,OWL.SameAs,products of Vegetable oils and fats
Dairy products,OWL.SameAs,Dairy products
Processed rice,OWL.SameAs,Processed rice
Sugar,OWL.SameAs,Sugar
Food products nec,OWL.SameAs,Food products nec
Beverages,OWL.SameAs,Beverages
Fish products,OWL.SameAs,Fish products
Tobacco products (16),OWL.SameAs,Tobacco products (16)
Textiles (17),OWL.SameAs,Textiles (17)
Wearing apparel; furs (18),OWL.SameAs,Wearing apparel; furs (18)
Leather and leather products (19),OWL.SameAs,Leather and leather products (19)
Wood and products of wood and cork (except furniture); articles of straw and plaiting materials (20),OWL.SameAs,Wood and products of wood and cork (except furniture); articles of straw and plaiting materials (20)
Wood material for treatment; Re-processing of secondary wood material into new wood material,OWL.SameAs,"Wood material for treatment, Re-processing of secondary wood material into new wood material"
Pulp,OWL.SameAs,Pulp
Secondary paper for treatment; Re-processing of secondary paper into new pulp,OWL.SameAs,"Secondary paper for treatment, Re-processing of secondary paper into new pulp"
Paper and paper products,OWL.SameAs,Paper and paper products
Printed matter and recorded media (22),OWL.SameAs,Printed matter and recorded media (22)
Coke Oven Coke,rdfs:subClassOf,Coke oven products
Gas Coke,rdfs:subClassOf,Coke oven products
Coal Tar,rdfs:subClassOf,Coke oven products
Motor Gasoline,rdfs:subClassOf, Refined Petroleum
Aviation Gasoline,rdfs:subClassOf, Refined Petroleum
Gasoline Type Jet Fuel,rdfs:subClassOf, Refined Petroleum
Kerosene Type Jet Fuel,rdfs:subClassOf, Refined Petroleum
Kerosene,rdfs:subClassOf, Refined Petroleum
Gas/Diesel Oil,rdfs:subClassOf, Refined Petroleum
Heavy Fuel Oil,rdfs:subClassOf, Refined Petroleum
Refinery Gas,rdfs:subClassOf, Refined Petroleum
Liquefied Petroleum Gases (LPG),rdfs:subClassOf, Refined Petroleum
Refinery Feedstocks,rdfs:subClassOf, Refined Petroleum
Ethane,rdfs:subClassOf, Refined Petroleum
Naphtha,rdfs:subClassOf, Refined Petroleum
White Spirit & SBP,rdfs:subClassOf, Refined Petroleum
Lubricants,rdfs:subClassOf, Refined Petroleum
Bitumen,rdfs:subClassOf, Refined Petroleum
Paraffin Waxes,rdfs:subClassOf, Refined Petroleum
Petroleum Coke,rdfs:subClassOf, Refined Petroleum
Non-specified Petroleum Products,rdfs:subClassOf, Refined Petroleum
Nuclear fuel,OWL.SameAs,Nuclear fuel
Plastics; basic,OWL.SameAs,"Plastics, basic"
Secondary plastic for treatment; Re-processing of secondary plastic into new plastic,OWL.SameAs,"Secondary plastic for treatment, Re-processing of secondary plastic into new plastic"
N-fertiliser,OWL.SameAs,N-fertiliser
P- and other fertiliser,OWL.SameAs,P- and other fertiliser
Chemicals nec,rdfs:subClassOf,Chemicals nec; additives and biofuels
Charcoal,rdfs:subClassOf,Chemicals nec; additives and biofuels
Additives/Blending Components,rdfs:subClassOf,Chemicals nec; additives and biofuels
Biogasoline,rdfs:subClassOf,Chemicals nec; additives and biofuels
Biodiesels,rdfs:subClassOf,Chemicals nec; additives and biofuels
Other Liquid Biofuels,rdfs:subClassOf,Chemicals nec; additives and biofuels
Rubber and plastic products (25),OWL.SameAs,Rubber and plastic products (25)
Glass and glass products,OWL.SameAs,Glass and glass products
Secondary glass for treatment; Re-processing of secondary glass into new glass,OWL.SameAs,"Secondary glass for treatment, Re-processing of secondary glass into new glass"
Ceramic goods,OWL.SameAs,Ceramic goods
Bricks; tiles and construction products; in baked clay,OWL.SameAs,"Bricks, tiles and construction products, in baked clay"
Cement; lime and plaster,OWL.SameAs,"Cement, lime and plaster"
Ash for treatment; Re-processing of ash into clinker,OWL.SameAs,"Ash for treatment, Re-processing of ash into clinker"
Other non-metallic mineral products,OWL.SameAs,Other non-metallic mineral products
Basic iron and steel and of ferro-alloys and first products thereof,OWL.SameAs,Basic iron and steel and of ferro-alloys and first products thereof
Secondary steel for treatment; Re-processing of secondary steel into new steel,OWL.SameAs,"Secondary steel for treatment, Re-processing of secondary steel into new steel"
Precious metals,OWL.SameAs,Precious metals
Secondary preciuos metals for treatment; Re-processing of secondary preciuos metals into new preciuos metals,OWL.SameAs,"Secondary preciuos metals for treatment, Re-processing of secondary preciuos metals into new preciuos metals"
Aluminium and aluminium products,OWL.SameAs,Aluminium and aluminium products
Secondary aluminium for treatment; Re-processing of secondary aluminium into new aluminium,OWL.SameAs,"Secondary aluminium for treatment, Re-processing of secondary aluminium into new aluminium"
Lead; zinc and tin and products thereof,OWL.SameAs,"Lead, zinc and tin and products thereof"
Secondary lead for treatment; Re-processing of secondary lead into new lead,OWL.SameAs,"Secondary lead for treatment, Re-processing of secondary lead into new lead"
Copper products,OWL.SameAs,Copper products
Secondary copper for treatment; Re-processing of secondary copper into new copper,OWL.SameAs,"Secondary copper for treatment, Re-processing of secondary copper into new copper"
Other non-ferrous metal products,OWL.SameAs,Other non-ferrous metal products
Secondary other non-ferrous metals for treatment; Re-processing of secondary other non-ferrous metals into new other non-ferrous metals,OWL.SameAs,"Secondary other non-ferrous metals for treatment, Re-processing of secondary other non-ferrous metals into new other non-ferrous metals"
Foundry work services,OWL.SameAs,Foundry work services
Fabricated metal products; except machinery and equipment (28),OWL.SameAs,"Fabricated metal products, except machinery and equipment (28)"
Machinery and equipment n.e.c. (29),OWL.SameAs,Machinery and equipment n.e.c. (29)
Office machinery and computers (30),OWL.SameAs,Office machinery and computers (30)
Electrical machinery and apparatus n.e.c. (31),OWL.SameAs,Electrical machinery and apparatus n.e.c. (31)
Radio; television and communication equipment and apparatus (32),OWL.SameAs,"Radio, television and communication equipment and apparatus (32)"
Medical; precision and optical instruments; watches and clocks (33),OWL.SameAs,"Medical, precision and optical instruments, watches and clocks (33)"
Motor vehicles; trailers and semi-trailers (34),OWL.SameAs,"Motor vehicles, trailers and semi-trailers (34)"
Other transport equipment (35),OWL.SameAs,Other transport equipment (35)
Furniture; other manufactured goods n.e.c. (36),OWL.SameAs,Furniture; other manufactured goods n.e.c. (36)
Secondary raw materials,OWL.SameAs,Secondary raw materials
Bottles for treatment; Recycling of bottles by direct reuse,OWL.SameAs,"Bottles for treatment, Recycling of bottles by direct reuse"
Electricity by coal,OWL.SameAs,Electricity by coal
Electricity by gas,OWL.SameAs,Electricity by gas
Electricity by nuclear,OWL.SameAs,Electricity by nuclear
Electricity by hydro,OWL.SameAs,Electricity by hydro
Electricity by wind,OWL.SameAs,Electricity by wind
Electricity by petroleum and other oil derivatives,OWL.SameAs,Electricity by petroleum and other oil derivatives
Electricity by biomass and waste,OWL.SameAs,Electricity by biomass and waste
Electricity by solar photovoltaic,OWL.SameAs,Electricity by solar photovoltaic
Electricity by solar thermal,OWL.SameAs,Electricity by solar thermal
Electricity by tide; wave; ocean,OWL.SameAs,"Electricity by tide, wave, ocean"
Electricity by Geothermal,OWL.SameAs,Electricity by Geothermal
Electricity nec,OWL.SameAs,Electricity nec
Transmission services of electricity,OWL.SameAs,Transmission services of electricity
Distribution and trade services of electricity,OWL.SameAs,Distribution and trade services of electricity
Coke oven gas,rdfs:subClassOf,Biogas an other gases nec.
Blast Furnace Gas,rdfs:subClassOf,Biogas an other gases nec.
Oxygen Steel Furnace Gas,rdfs:subClassOf,Biogas an other gases nec.
Gas Works Gas,rdfs:subClassOf,Biogas an other gases nec.
Biogas,rdfs:subClassOf,Biogas an other gases nec.
Distribution services of gaseous fuels through mains,OWL.SameAs,Distribution services of gaseous fuels through mains
Steam and hot water supply services,OWL.SameAs,Steam and hot water supply services
Collected and purified water; distribution services of water (41),OWL.SameAs,"Collected and purified water, distribution services of water (41)"
Construction work (45),OWL.SameAs,Construction work (45)
Secondary construction material for treatment; Re-processing of secondary construction material into aggregates,OWL.SameAs,"Secondary construction material for treatment, Re-processing of secondary construction material into aggregates"
Sale; maintenance; repair of motor vehicles; motor vehicles parts; motorcycles; motor cycles parts and accessoiries,OWL.SameAs,"Sale, maintenance, repair of motor vehicles, motor vehicles parts, motorcycles, motor cycles parts and accessoiries"
Retail trade services of motor fuel,OWL.SameAs,Retail trade services of motor fuel
Wholesale trade and commission trade services; except of motor vehicles and motorcycles (51),OWL.SameAs,"Wholesale trade and commission trade services, except of motor vehicles and motorcycles (51)"
Retail  trade services; except of motor vehicles and motorcycles; repair services of personal and household goods (52),OWL.SameAs,"Retail  trade services, except of motor vehicles and motorcycles; repair services of personal and household goods (52)"
Hotel and restaurant services (55),OWL.SameAs,Hotel and restaurant services (55)
Railway transportation services,OWL.SameAs,Railway transportation services
Other land transportation services,OWL.SameAs,Other land transportation services
Transportation services via pipelines,OWL.SameAs,Transportation services via pipelines
Sea and coastal water transportation services,OWL.SameAs,Sea and coastal water transportation services
Inland water transportation services,OWL.SameAs,Inland water transportation services
Air transport services (62),OWL.SameAs,Air transport services (62)
Supporting and auxiliary transport services; travel agency services (63),OWL.SameAs,Supporting and auxiliary transport services; travel agency services (63)
Post and telecommunication services (64),OWL.SameAs,Post and telecommunication services (64)
Financial intermediation services; except insurance and pension funding services (65),OWL.SameAs,"Financial intermediation services, except insurance and pension funding services (65)"
Insurance and pension funding services; except compulsory social security services (66),OWL.SameAs,"Insurance and pension funding services, except compulsory social security services (66)"
Services auxiliary to financial intermediation (67),OWL.SameAs,Services auxiliary to financial intermediation (67)
Real estate services (70),OWL.SameAs,Real estate services (70)
Renting services of machinery and equipment without operator and of personal and household goods (71),OWL.SameAs,Renting services of machinery and equipment without operator and of personal and household goods (71)
Computer and related services (72),OWL.SameAs,Computer and related services (72)
Research and development services (73),OWL.SameAs,Research and development services (73)
Other business services (74),OWL.SameAs,Other business services (74)
Public administration and defence services; compulsory social security services (75),OWL.SameAs,Public administration and defence services; compulsory social security services (75)
Education services (80),OWL.SameAs,Education services (80)
Health and social work services (85),OWL.SameAs,Health and social work services (85)
Food waste for treatment: incineration,OWL.SameAs,Food waste for treatment: incineration
Paper waste for treatment: incineration,OWL.SameAs,Paper waste for treatment: incineration
Plastic waste for treatment: incineration,OWL.SameAs,Plastic waste for treatment: incineration
Intert/metal waste for treatment: incineration,OWL.SameAs,Intert/metal waste for treatment: incineration
Textiles waste for treatment: incineration,OWL.SameAs,Textiles waste for treatment: incineration
Wood waste for treatment: incineration,OWL.SameAs,Wood waste for treatment: incineration
Oil/hazardous waste for treatment: incineration,OWL.SameAs,Oil/hazardous waste for treatment: incineration
Food waste for treatment: biogasification and land application,OWL.SameAs,Food waste for treatment: biogasification and land application
Paper waste for treatment: biogasification and land application,OWL.SameAs,Paper waste for treatment: biogasification and land application
Sewage sludge for treatment: biogasification and land application,OWL.SameAs,Sewage sludge for treatment: biogasification and land application
Food waste for treatment: composting and land application,OWL.SameAs,Food waste for treatment: composting and land application
Paper and wood waste for treatment: composting and land application,OWL.SameAs,Paper and wood waste for treatment: composting and land application
Food waste for treatment: waste water treatment,OWL.SameAs,Food waste for treatment: waste water treatment
Other waste for treatment: waste water treatment,OWL.SameAs,Other waste for treatment: waste water treatment
Food waste for treatment: landfill,OWL.SameAs,Food waste for treatment: landfill
Paper for treatment: landfill,OWL.SameAs,Paper for treatment: landfill
Plastic waste for treatment: landfill,OWL.SameAs,Plastic waste for treatment: landfill
Inert/metal/hazardous waste for treatment: landfill,OWL.SameAs,Inert/metal/hazardous waste for treatment: landfill
Textiles waste for treatment: landfill,OWL.SameAs,Textiles waste for treatment: landfill
Wood waste for treatment: landfill,OWL.SameAs,Wood waste for treatment: landfill
Membership organisation services n.e.c. (91),OWL.SameAs,Membership organisation services n.e.c. (91)
Recreational; cultural and sporting services (92),OWL.SameAs,"Recreational, cultural and sporting services (92)"
Other services (93),OWL.SameAs,Other services (93)
Private households with employed persons (95),OWL.SameAs,Private households with employed persons (95)
Extra-territorial organizations and bodies,OWL.SameAs,Extra-territorial organizations and bodies
